PokerStars Hand #229343364648:  Hold'em No Limit ($0.01/$0.02 USD) - 2021/08/25 22:56:29 PT [2021/08/26 1:56:29 ET]
Table 'Furud' 9-max Seat #7 is the button
Seat 1: Dorex2007 ($2.19 in chips) 
Seat 2: MilvusMystry ($2 in chips) 
Seat 3: GeorgeRussel ($3.03 in chips) 
Seat 4: Realtor59 ($3.18 in chips) 
Seat 5: 111kok111444 ($0.80 in chips) 
Seat 6: Stefan987695 ($0.62 in chips) 
Seat 7: Ivo Novk ($2 in chips) 
Seat 8: JugEars88 ($1.48 in chips) 
Seat 9: Bruno120 ($4.69 in chips) 
JugEars88: posts small blind $0.01
Bruno120: posts big blind $0.02
111kok111444: posts big blind $0.02
*** HOLE CARDS ***
Dealt to Dorex2007 [7c Jh]
Dorex2007: folds 
MilvusMystry: folds 
GeorgeRussel: raises $0.05 to $0.07
Realtor59: folds 
111kok111444: folds 
Stefan987695: folds 
Ivo Novk: folds 
JugEars88: folds 
Bruno120: folds 
Uncalled bet ($0.05) returned to GeorgeRussel
GeorgeRussel collected $0.07 from pot
GeorgeRussel: doesn't show hand 
*** SUMMARY ***
Total pot $0.07 | Rake $0 
Seat 1: Dorex2007 folded before Flop (didn't bet)
Seat 2: MilvusMystry folded before Flop (didn't bet)
Seat 3: GeorgeRussel collected ($0.07)
Seat 4: Realtor59 folded before Flop (didn't bet)
Seat 5: 111kok111444 folded before Flop (didn't bet)
Seat 6: Stefan987695 folded before Flop (didn't bet)
Seat 7: Ivo Novk (button) folded before Flop (didn't bet)
Seat 8: JugEars88 (small blind) folded before Flop
Seat 9: Bruno120 (big blind) folded before Flop



PokerStars Hand #229343366801:  Hold'em No Limit ($0.01/$0.02 USD) - 2021/08/25 22:56:47 PT [2021/08/26 1:56:47 ET]
Table 'Furud' 9-max Seat #8 is the button
Seat 1: Dorex2007 ($2.19 in chips) 
Seat 2: MilvusMystry ($2 in chips) 
Seat 3: GeorgeRussel ($3.08 in chips) 
Seat 4: Realtor59 ($3.18 in chips) 
Seat 5: 111kok111444 ($0.78 in chips) 
Seat 6: Stefan987695 ($0.62 in chips) 
Seat 7: Ivo Novk ($2 in chips) 
Seat 8: JugEars88 ($1.47 in chips) 
Seat 9: Bruno120 ($4.67 in chips) 
Bruno120: posts small blind $0.01
Dorex2007: posts big blind $0.02
*** HOLE CARDS ***
Dealt to Dorex2007 [3s 8h]
MilvusMystry: folds 
GeorgeRussel: folds 
Realtor59: folds 
111kok111444: raises $0.02 to $0.04
Stefan987695: folds 
Ivo Novk: folds 
JugEars88: folds 
Bruno120: folds 
Dorex2007: folds 
Uncalled bet ($0.02) returned to 111kok111444
111kok111444 collected $0.05 from pot
111kok111444: doesn't show hand 
*** SUMMARY ***
Total pot $0.05 | Rake $0 
Seat 1: Dorex2007 (big blind) folded before Flop
Seat 2: MilvusMystry folded before Flop (didn't bet)
Seat 3: GeorgeRussel folded before Flop (didn't bet)
Seat 4: Realtor59 folded before Flop (didn't bet)
Seat 5: 111kok111444 collected ($0.05)
Seat 6: Stefan987695 folded before Flop (didn't bet)
Seat 7: Ivo Novk folded before Flop (didn't bet)
Seat 8: JugEars88 (button) folded before Flop (didn't bet)
Seat 9: Bruno120 (small blind) folded before Flop



PokerStars Hand #229343368694:  Hold'em No Limit ($0.01/$0.02 USD) - 2021/08/25 22:57:05 PT [2021/08/26 1:57:05 ET]
Table 'Furud' 9-max Seat #9 is the button
Seat 1: Dorex2007 ($2.17 in chips) 
Seat 2: MilvusMystry ($2 in chips) 
Seat 3: GeorgeRussel ($3.08 in chips) 
Seat 4: Realtor59 ($3.18 in chips) 
Seat 5: 111kok111444 ($0.81 in chips) 
Seat 6: Stefan987695 ($0.62 in chips) 
Seat 7: Ivo Novk ($2 in chips) 
Seat 8: JugEars88 ($1.47 in chips) 
Seat 9: Bruno120 ($4.66 in chips) 
Dorex2007: posts small blind $0.01
MilvusMystry: posts big blind $0.02
*** HOLE CARDS ***
Dealt to Dorex2007 [Td 4c]
GeorgeRussel: folds 
Realtor59: folds 
111kok111444: raises $0.02 to $0.04
Stefan987695: calls $0.04
Ivo Novk: folds 
JugEars88: folds 
Bruno120: calls $0.04
Dorex2007: folds 
MilvusMystry: folds 
*** FLOP *** [3d 9h 8s]
111kok111444: bets $0.02
Stefan987695: calls $0.02
Bruno120: folds 
*** TURN *** [3d 9h 8s] [2d]
111kok111444: bets $0.02
Stefan987695: calls $0.02
*** RIVER *** [3d 9h 8s 2d] [6s]
111kok111444: bets $0.04
Stefan987695: calls $0.04
*** SHOW DOWN ***
111kok111444: shows [Ah Qs] (high card Ace)
Stefan987695: mucks hand 
111kok111444 collected $0.30 from pot
*** SUMMARY ***
Total pot $0.31 | Rake $0.01 
Board [3d 9h 8s 2d 6s]
Seat 1: Dorex2007 (small blind) folded before Flop
Seat 2: MilvusMystry (big blind) folded before Flop
Seat 3: GeorgeRussel folded before Flop (didn't bet)
Seat 4: Realtor59 folded before Flop (didn't bet)
Seat 5: 111kok111444 showed [Ah Qs] and won ($0.30) with high card Ace
Seat 6: Stefan987695 mucked [Ac Jc]
Seat 7: Ivo Novk folded before Flop (didn't bet)
Seat 8: JugEars88 folded before Flop (didn't bet)
Seat 9: Bruno120 (button) folded on the Flop



PokerStars Hand #229343380544:  Hold'em No Limit ($0.01/$0.02 USD) - 2021/08/25 22:57:58 PT [2021/08/26 1:57:58 ET]
Table 'Furud' 9-max Seat #1 is the button
Seat 1: Dorex2007 ($2.16 in chips) 
Seat 2: MilvusMystry ($2 in chips) 
Seat 3: GeorgeRussel ($3.08 in chips) 
Seat 4: Realtor59 ($3.18 in chips) 
Seat 5: 111kok111444 ($0.99 in chips) 
Seat 6: Stefan987695 ($0.50 in chips) 
Seat 7: Ivo Novk ($2 in chips) 
Seat 8: JugEars88 ($1.47 in chips) 
Seat 9: Bruno120 ($4.62 in chips) 
MilvusMystry: posts small blind $0.01
GeorgeRussel: posts big blind $0.02
*** HOLE CARDS ***
Dealt to Dorex2007 [2h Js]
Realtor59: raises $0.04 to $0.06
111kok111444: folds 
Stefan987695: folds 
Ivo Novk: folds 
JugEars88: folds 
Bruno120: folds 
Dorex2007: folds 
MilvusMystry: calls $0.05
GeorgeRussel: folds 
*** FLOP *** [3c 4s Jh]
MilvusMystry: bets $0.07
Realtor59: calls $0.07
*** TURN *** [3c 4s Jh] [8h]
MilvusMystry: checks 
Realtor59: bets $0.14
MilvusMystry: calls $0.14
*** RIVER *** [3c 4s Jh 8h] [8c]
MilvusMystry: checks 
Realtor59: bets $0.42
MilvusMystry: folds 
Uncalled bet ($0.42) returned to Realtor59
Realtor59 collected $0.54 from pot
Realtor59: doesn't show hand 
*** SUMMARY ***
Total pot $0.56 | Rake $0.02 
Board [3c 4s Jh 8h 8c]
Seat 1: Dorex2007 (button) folded before Flop (didn't bet)
Seat 2: MilvusMystry (small blind) folded on the River
Seat 3: GeorgeRussel (big blind) folded before Flop
Seat 4: Realtor59 collected ($0.54)
Seat 5: 111kok111444 folded before Flop (didn't bet)
Seat 6: Stefan987695 folded before Flop (didn't bet)
Seat 7: Ivo Novk folded before Flop (didn't bet)
Seat 8: JugEars88 folded before Flop (didn't bet)
Seat 9: Bruno120 folded before Flop (didn't bet)



